{
  "schemaVersion": "0.1.0",
  "id": "mem_template",
  "scope": "project",
  "kind": "preference",
  "subject": "workflow",
  "content": "redacted structured summary only",
  "source": "manual",
  "confidence": "owner_asserted",
  "visibility": "project-local",
  "status": "tentative",
  "createdAt": "1970-01-01T00:00:00Z",
  "updatedAt": "1970-01-01T00:00:00Z",
  "expiresAt": null,
  "reviewAfter": null,
  "redaction": "none",
  "hash": "sha256:template"
}
