{
  "schemaVersion": "0.1.0",
  "id": "mem_blocked_secret_example",
  "scope": "project",
  "kind": "constraint",
  "subject": "security",
  "content": "BLOCKED: do not store secret-like values, auth headers, provider payloads, or placeholder secret values in memory.",
  "source": "manual",
  "confidence": "verified",
  "visibility": "project-local",
  "status": "rejected",
  "createdAt": "1970-01-01T00:00:00Z",
  "updatedAt": "1970-01-01T00:00:00Z",
  "expiresAt": null,
  "reviewAfter": null,
  "redaction": "blocked",
  "hash": "hash:blocked-example"
}
